{
  "context": "The system will digitize voice-based trading processes for trades valued under $1 million, replacing manual phone-based workflows with an automated electronic platform. This addresses compliance requirements for Singapore and Indonesia markets while ensuring auditability, transparency, and reduced operational risk in low-value trade execution.",
  "userStories": [
    {
      "id": "US-1",
      "title": "Voice Trade Data Capture",
      "asA": "Trader",
      "iWantTo": "capture voice trade details electronically in real-time",
      "soThat": "I can reduce manual errors and ensure all trade data is accurately recorded",
      "storyPoints": 5,
      "priority": "Critical",
      "tags": ["Backend", "API", "Data Entry", "Voice Recognition"],
      "relatedUserStories": [],
      "epic": "Trade Capture and Processing",
      "acceptanceCriteria": [
        {
          "id": "AC-1",
          "given": "A voice trade call is initiated",
          "when": "Trade details are spoken by the trader",
          "then": "System captures and converts voice to structured trade data"
        },
        {
          "id": "AC-2",
          "given": "Trade data is captured from voice",
          "when": "Conversion is complete",
          "then": "Data is displayed for verification within 2 seconds"
        },
        {
          "id": "AC-3",
          "given": "Voice trade data is captured",
          "when": "Data contains ambiguous or unclear information",
          "then": "System highlights fields requiring manual review"
        }
      ]
    },
    {
      "id": "US-2",
      "title": "Trade Validation and Compliance",
      "asA": "Compliance Officer",
      "iWantTo": "automatically validate trades against Singapore and Indonesia regulations",
      "soThat": "I ensure all trades comply with local laws before execution",
      "storyPoints": 8,
      "priority": "Critical",
      "tags": ["Compliance", "Validation", "Backend", "Security"],
      "relatedUserStories": ["US-1"],
      "epic": "Compliance and Risk Management",
      "acceptanceCriteria": [
        {
          "id": "AC-4",
          "given": "A trade is submitted for validation",
          "when": "Trade origin is Singapore",
          "then": "System applies Singapore MAS regulations"
        },
        {
          "id": "AC-5",
          "given": "A trade is submitted for validation",
          "when": "Trade origin is Indonesia",
          "then": "System applies OJK regulations"
        },
        {
          "id": "AC-6",
          "given": "A trade fails compliance validation",
          "when": "Validation is complete",
          "then": "System blocks execution and provides detailed rejection reason"
        }
      ]
    },
    {
      "id": "US-3",
      "title": "Trade Confirmation and Notification",
      "asA": "Operations Manager",
      "iWantTo": "receive real-time notifications of trade confirmations",
      "soThat": "I can monitor trade flow and respond to issues immediately",
      "storyPoints": 3,
      "priority": "High",
      "tags": ["Frontend", "Notifications", "Real-time", "Dashboard"],
      "relatedUserStories": ["US-1", "US-2"],
      "epic": "Trade Capture and Processing",
      "acceptanceCriteria": [
        {
          "id": "AC-7",
          "given": "A trade is successfully executed",
          "when": "Confirmation is received",
          "then": "System sends notification within 1 second"
        },
        {
          "id": "AC-8",
          "given": "Multiple trades are executed",
          "when": "User views dashboard",
          "then": "All trade confirmations are displayed in chronological order"
        }
      ]
    },
    {
      "id": "US-4",
      "title": "Audit Trail Management",
      "asA": "Auditor",
      "iWantTo": "access complete audit trails for all voice trades",
      "soThat": "I can review trade history and ensure regulatory compliance",
      "storyPoints": 5,
      "priority": "High",
      "tags": ["Audit", "Logging", "Database", "Compliance"],
      "relatedUserStories": ["US-1", "US-2", "US-3"],
      "epic": "Compliance and Risk Management",
      "acceptanceCriteria": [
        {
          "id": "AC-9",
          "given": "A trade has been executed",
          "when": "Audit trail is requested",
          "then": "System provides complete trade lifecycle including voice recording reference"
        },
        {
          "id": "AC-10",
          "given": "Audit search is performed",
          "when": "Date range is specified",
          "then": "System returns all trades within range with full details"
        },
        {
          "id": "AC-11",
          "given": "Audit trail is accessed",
          "when": "Export is requested",
          "then": "System generates compliant audit report in PDF/Excel format"
        }
      ]
    },
    {
      "id": "US-5",
      "title": "Voice Recording Integration",
      "asA": "Risk Manager",
      "iWantTo": "link electronic trade records with original voice recordings",
      "soThat": "I can verify trade details against source conversations when needed",
      "storyPoints": 8,
      "priority": "High",
      "tags": ["Integration", "Voice Recording", "Storage", "Backend"],
      "relatedUserStories": ["US-1", "US-4"],
      "epic": "Trade Capture and Processing",
      "acceptanceCriteria": [
        {
          "id": "AC-12",
          "given": "A voice trade is captured",
          "when": "Trade is saved",
          "then": "System stores reference to voice recording with timestamp"
        },
        {
          "id": "AC-13",
          "given": "Trade record is accessed",
          "when": "Voice playback is requested",
          "then": "System retrieves and plays corresponding voice segment"
        }
      ]
    },
    {
      "id": "US-6",
      "title": "Trade Amendment and Cancellation",
      "asA": "Trader",
      "iWantTo": "amend or cancel voice trades before settlement",
      "soThat": "I can correct errors or respond to client requests",
      "storyPoints": 5,
      "priority": "Medium",
      "tags": ["Trade Management", "Backend", "API", "Workflow"],
      "relatedUserStories": ["US-1", "US-2", "US-4"],
      "epic": "Trade Capture and Processing",
      "acceptanceCriteria": [
        {
          "id": "AC-14",
          "given": "A trade is pending settlement",
          "when": "Amendment is requested",
          "then": "System allows modification with approval workflow"
        },
        {
          "id": "AC-15",
          "given": "A trade amendment is made",
          "when": "Amendment is saved",
          "then": "System creates audit entry with reason and approver"
        },
        {
          "id": "AC-16",
          "given": "A trade cancellation is requested",
          "when": "Cancellation is approved",
          "then": "System reverses trade and notifies all parties"
        }
      ]
    }
  ],
  "functionalRequirements": [
    {
      "id": "FR-1",
      "description": "System shall capture and convert voice trade data to electronic format",
      "inputs": ["Voice audio stream", "Trader ID", "Trade context metadata"],
      "outputs": ["Structured trade object", "Confidence score", "Fields requiring review"],
      "mainFlow": [
        "Receive voice audio stream",
        "Apply voice recognition with financial terminology",
        "Extract trade parameters",
        "Structure data into trade object",
        "Calculate confidence score",
        "Flag low-confidence fields"
      ],
      "triggers": ["Voice call initiation", "Manual trade entry request"],
      "relatedUserStories": ["US-1"]
    },
    {
      "id": "FR-2",
      "description": "System shall validate trades against jurisdiction-specific regulations",
      "inputs": ["Trade data", "Jurisdiction (SG/ID)", "Counterparty information"],
      "outputs": ["Validation status", "Compliance report", "Rejection reasons if applicable"],
      "mainFlow": [
        "Identify trade jurisdiction",
        "Load applicable regulatory rules",
        "Execute validation checks",
        "Generate compliance report",
        "Return validation result"
      ],
      "triggers": ["Trade submission", "Pre-execution validation request"],
      "relatedUserStories": ["US-2"]
    },
    {
      "id": "FR-3",
      "description": "System shall maintain comprehensive audit trail for all trades",
      "inputs": ["Trade events", "User actions", "System decisions"],
      "outputs": ["Audit log entries", "Audit reports", "Compliance certificates"],
      "mainFlow": [
        "Capture triggering event",
        "Record timestamp and user",
        "Log event details",
        "Store in immutable audit store",
        "Index for search"
      ],
      "triggers": ["Any trade state change", "User action", "System decision"],
      "relatedUserStories": ["US-4"]
    },
    {
      "id": "FR-4",
      "description": "System shall integrate voice recordings with trade records",
      "inputs": ["Voice recording file", "Trade ID", "Timestamp range"],
      "outputs": ["Recording reference", "Playback capability", "Transcription"],
      "mainFlow": [
        "Store voice recording",
        "Create recording metadata",
        "Link to trade record",
        "Enable playback interface",
        "Generate searchable transcription"
      ],
      "triggers": ["Trade capture completion", "Recording upload"],
      "relatedUserStories": ["US-5"]
    },
    {
      "id": "FR-5",
      "description": "System shall provide real-time notifications for trade events",
      "inputs": ["Trade events", "User preferences", "Notification rules"],
      "outputs": ["Push notifications", "Email alerts", "Dashboard updates"],
      "mainFlow": [
        "Detect trade event",
        "Identify notification recipients",
        "Apply notification rules",
        "Send notifications via configured channels",
        "Update dashboard"
      ],